Title,URL,Image Filename,Description,Authors,Publication Date,Article Type,Abstract
Increasing risk of glacial lake outburst floods from future Third Pole deglaciation,https://www.nature.com/articles/s41558-021-01028-3,nature_articles/images_2021/Increasing risk of glacial lake outburst floods from future Third Pole deglaciation.jpg,"Global warming-driven deglaciation in high-mountain Asia raises the likelihood of natural dam failure and associated glacial lake outburst flood risk. This is estimated for lake development under present-day and future warming scenarios, highlighting emerging hotspots and transboundary impacts.","Guoxiong Zheng, Simon Keith Allen, Markus Stoffel",No publication date,Article,"Warming on Earth’s Third Pole is leading to rapid loss of ice and the formation and expansion of glacial lakes, posing a severe threat to downstream communities. Here we provide a holistic assessment of past evolution, present state and modelled future change of glacial lakes and related glacial lake outburst flood (GLOF) risk across the Third Pole. We show that the highest GLOF risk is at present centred in the eastern Himalaya, where the current risk level is at least twice that in adjacent regions. In the future, GLOF risk will potentially almost triple as a consequence of further lake development, and additional hotspots will emerge to the west, including within transboundary regions. With apparent increases in GLOF risk already anticipated by the mid-twenty-first century in some regions, the results highlight the urgent need for forward-looking, collaborative, long-term approaches to mitigate future impacts and enhance sustainable development across the Third Pole."
Carbon loss from forest degradation exceeds that from deforestation in the Brazilian Amazon,https://www.nature.com/articles/s41558-021-01026-5,nature_articles/images_2021/Carbon loss from forest degradation exceeds that from deforestation in the Brazilian Amazon.jpg,"Carbon loss from forests occurs through deforestation or the degradation of existing forest. The loss of forest area in the Brazilian Amazon was higher in 2019 than following drought and an El Niño event in 2015, yet degradation drove three times more biomass loss than deforestation from 2010 to 2019.","Yuanwei Qin, Xiangming Xiao, Berrien Moore III",No publication date,Article,"Spatial–temporal dynamics of aboveground biomass (AGB) and forest area affect the carbon cycle, climate and biodiversity in the Brazilian Amazon. Here we investigate interannual changes in AGB and forest area by analysing satellite-based annual AGB and forest area datasets. We found that the gross forest area loss was larger in 2019 than in 2015, possibly due to recent loosening of forest protection policies. However, the net AGB loss was three times smaller in 2019 than in 2015. During 2010–2019, the Brazilian Amazon had a cumulative gross loss of 4.45 Pg C against a gross gain of 3.78 Pg C, resulting in a net AGB loss of 0.67 Pg C. Forest degradation (73%) contributed three times more to the gross AGB loss than deforestation (27%), given that the areal extent of degradation exceeds that of deforestation. This indicates that forest degradation has become the largest process driving carbon loss and should become a higher policy priority."
Disturbance suppresses the aboveground carbon sink in North American boreal forests,https://www.nature.com/articles/s41558-021-01027-4,nature_articles/images_2021/Disturbance suppresses the aboveground carbon sink in North American boreal forests.jpg,"Disturbance regimes from fire, drought, harvest and insects will probably intensify in the future and under climate change. Despite partial offsets from regrowth, disturbance from fire and harvest reduces carbon uptake and storage in boreal forests, impacting the strength of this carbon sink.","Jonathan A. Wang, Alessandro Baccini, Mark A. Friedl",No publication date,Article,"Climate change is altering vegetation and disturbance dynamics in boreal ecosystems. However, the aggregate impact of these changes on boreal carbon budgets is not well understood. Here we combined multiple satellite datasets to estimate annual stocks and changes in aboveground biomass (AGB) across boreal northwestern North America. From 1984 to 2014, the 2.82 × 106km2study region gained 434 ± 176 Tg of AGB. Fires resulted in losses of 789 ± 48 Tg, which were mostly compensated by post-fire recovery of 642 ± 86 Tg. Timber harvests contributed to losses of 74 ± 5 Tg, which were partly offset by post-harvest recovery of 32 ± 9 Tg. Earth system models overestimated AGB accumulation by a factor of 3 (+1,519 ± 171 Tg), which suggests that these models overestimate the terrestrial carbon sink in boreal ecosystems and highlights the need to improve representation of fire and other disturbance processes in these models."
Critical adjustment of land mitigation pathways for assessing countries’ climate progress,https://www.nature.com/articles/s41558-021-01033-6,nature_articles/images_2021/Critical adjustment of land mitigation pathways for assessing countries_ climate progress.jpg,"There is a mismatch between emission estimates from global land use calculated from IAMs and countries’ greenhouse gas inventories. This study presents a method for reconciling these estimates by reallocating part of the land-use sink, facilitating progress assessment towards climate goals.","Giacomo Grassi, Elke Stehfest, Alexander Popp",No publication date,Article,"Mitigation pathways by Integrated Assessment Models (IAMs) describe future emissions that keep global warming below specific temperature limits and are compared with countries’ collective greenhouse gas (GHG) emission reduction pledges. This is needed to assess mitigation progress and inform emission targets under the Paris Agreement. Currently, however, a mismatch of ~5.5 GtCO2yr−1exists between the global land-use fluxes estimated with IAMs and from countries’ GHG inventories. Here we present a ‘Rosetta stone’ adjustment to translate IAMs’ land-use mitigation pathways to estimates more comparable with GHG inventories. This does not change the original decarbonization pathways, but reallocates part of the land sink to be consistent with GHG inventories. Adjusted cumulative emissions over the period until net zero for 1.5 or 2 °C limits are reduced by 120–192 GtCO2relative to the original IAM pathways. These differences should be taken into account to ensure an accurate assessment of progress towards the Paris Agreement."
Global changes in oceanic mesoscale currents over the satellite altimetry record,https://www.nature.com/articles/s41558-021-01006-9,nature_articles/images_2021/Global changes in oceanic mesoscale currents over the satellite altimetry record.jpg,"Mesoscale eddy variability has increased in eddy-rich regions by 2–5% per decade but decreased in the tropical ocean over the satellite record (1993–2020). These changes will impact ocean–atmosphere heat and carbon exchange, with implications for regional and global climate.","Josué Martínez-Moreno, Andrew McC. Hogg, Adele K. Morrison",No publication date,Article,"Oceanic mesoscale eddies play a profound role in mixing tracers such as heat, carbon and nutrients, thereby regulating regional and global climate. Yet, it remains unclear how the eddy field has varied over the past few decades. Furthermore, climate model predictions generally do not resolve mesoscale eddies, which could limit their accuracy in simulating future climate change. Here we show a global statistically significant increase of ocean eddy activity using two independent observational datasets of surface mesoscale eddy variability (one estimates surface currents, and the other is derived from sea surface temperature). Maps of mesoscale variability trends show heterogeneous patterns, with eddy-rich regions showing a significant increase in mesoscale variability of 2–5% per decade, while the tropical oceans show a decrease in mesoscale variability. This readjustment of the surface mesoscale ocean circulation has important implications for the exchange of heat and carbon between the ocean and atmosphere."
Focusing on differences across scenarios could lead to bad adaptation policy advice,https://www.nature.com/articles/s41558-021-01030-9,nature_articles/images_2021/Focusing on differences across scenarios could lead to bad adaptation policy advice.jpg,"Evaluation of climate adaptation policies typically compares differences between scenarios with different levels of, or without, climate change. Many policies, however, address development simultaneously, and focusing only on climate change impacts may not identify the best outcome.","Bramka Arga Jafino, Stephane Hallegatte, Julie Rozenberg",No publication date,Brief Communication,"As development and adaptation are closely intertwined, assessing the benefits of adaptation by focusing only on how it reduces climate impacts could lead to misleading policy advice. In some cases, trying to minimize climate impacts could lead to inferior outcomes. It is preferable to explore how policies influence the absolute level of metrics of interest in scenarios with climate change rather than to focus on how they influence incremental climate impacts."
Winter melt trends portend widespread declines in snow water resources,https://www.nature.com/articles/s41558-021-01014-9,nature_articles/images_2021/Winter melt trends portend widespread declines in snow water resources.jpg,"Mountain snowpack declines are often tracked using snow water equivalent trends sensitive to highly variable precipitation. Observational work proposes temperature-driven daily snowmelt during the accumulation season as an alternative metric, with increases that are three times more widespread.","Keith N. Musselman, Nans Addor, Noah P. Molotch",No publication date,Article,"In many mountainous regions, winter precipitation accumulates as snow that melts in the spring and summer, which provides water to one billion people globally. Climate warming and earlier snowmelt compromise this natural water storage. Although snowpack trend analyses commonly focus on the snow water equivalent (SWE), we propose that trends in the accumulation season snowmelt serve as a critical indicator of hydrological change. Here we compare long-term changes in the snowmelt and SWE from snow monitoring stations in western North America and find 34% of stations exhibit increasing winter snowmelt trends (P< 0.05), a factor of three larger than the 11% showing SWE declines (P< 0.05). Snowmelt trends are highly sensitive to temperature and an underlying warming signal, whereas SWE trends are more sensitive to precipitation variability. Thus, continental-scale snow water resources are in steeper decline than inferred from SWE trends alone. More winter snowmelt will complicate future water resource planning and management."
Future increases in Arctic lightning and fire risk for permafrost carbon,https://www.nature.com/articles/s41558-021-01011-y,nature_articles/images_2021/Future increases in Arctic lightning and fire risk for permafrost carbon.jpg,"Changes in lightning activity are uncertain under climate change. The authors project that summer lightning in the Arctic is likely to more than double by the end of the century, with implications for lightning-strike tundra wildfires and associated carbon release from permafrost.","Yang Chen, David M. Romps, James T. Randerson",No publication date,Article,"Lightning is an indicator and a driver of climate change. Here, using satellite observations of lightning flash rate and ERA5 reanalysis, we find that the spatial pattern of summer lightning over northern circumpolar regions exhibits a strong positive relationship with the product of convective available potential energy (CAPE) and precipitation. Applying this relationship to Climate Model Intercomparison Project Phase 5 climate projections for a high-emissions scenario (RCP8.5) shows an increase in CAPE (86 ± 22%) and precipitation (17 ± 2%) in areas underlain by permafrost, causing summer lightning to increase by 112 ± 38% by the end of the century (2081–2100). Future flash rates at the northern treeline are comparable to current levels 480 km to the south in boreal forests. We hypothesize that lightning increases may induce a fire–vegetation feedback whereby more burning in Arctic tundra expedites the northward migration of boreal trees, with the potential to accelerate the positive feedback associated with permafrost soil carbon release."
Anthropogenic climate change has slowed global agricultural productivity growth,https://www.nature.com/articles/s41558-021-01000-1,nature_articles/images_2021/Anthropogenic climate change has slowed global agricultural productivity growth.jpg,"Agricultural productivity has increased historically, but the impact of climate change on productivity growth is not clear. In the last 60 years, anthropogenic climate change has reduced agricultural total factor production globally by 21%, with stronger impacts in warmer regions.","Ariel Ortiz-Bobea, Toby R. Ault, David B. Lobell",No publication date,Article,"Agricultural research has fostered productivity growth, but the historical influence of anthropogenic climate change (ACC) on that growth has not been quantified. We develop a robust econometric model of weather effects on global agricultural total factor productivity (TFP) and combine this model with counterfactual climate scenarios to evaluate impacts of past climate trends on TFP. Our baseline model indicates that ACC has reduced global agricultural TFP by about 21% since 1961, a slowdown that is equivalent to losing the last 7 years of productivity growth. The effect is substantially more severe (a reduction of ~26–34%) in warmer regions such as Africa and Latin America and the Caribbean. We also find that global agriculture has grown more vulnerable to ongoing climate change."
The importance of warm habitat to the growth regime of cold-water fishes,https://www.nature.com/articles/s41558-021-00994-y,nature_articles/images_2021/The importance of warm habitat to the growth regime of cold-water fishes.jpg,"Modelling riverine fish growth across warm and cool sections of a river network, the authors demonstrate that habitats that are suboptimally warm in summer may actually provide the majority of growth potential. This highlights a risk in conservation strategies that devalue ephemerally warm habitats.","Jonathan B. Armstrong, Aimee H. Fullerton, Gordon H. Reeves",No publication date,Article,"A common goal of biological adaptation planning is to identify and prioritize locations that remain suitably cool during the summer. This implicitly devalues areas that are ephemerally warm, even if they are suitable most of the year for mobile animals. Here we develop an alternative conceptual framework, the growth regime, which considers seasonal and landscape variation in physiological performance, focusing on riverine fish. Using temperature models for 14 river basins, we show that growth opportunities propagate up and down river networks on a seasonal basis, and that downstream habitats that are suboptimally warm in summer may actually provide the majority of growth potential expressed annually. We demonstrate with an agent-based simulation that the shoulder-season use of warmer downstream habitats can fuel annual fish production. Our work reveals a synergy between cold and warm habitats that could be fundamental to support cold-water fisheries, and highlights the risk in conservation strategies that underappreciate warm habitats."
Fungal decomposition of river organic matter accelerated by decreasing glacier cover,https://www.nature.com/articles/s41558-021-01004-x,nature_articles/images_2021/Fungal decomposition of river organic matter accelerated by decreasing glacier cover.jpg,"The impact of glacier retreat on fungal-driven decomposition in rivers is investigated using a standardized test across six countries. Less glacier cover is linked to increased decomposition, which is in turn associated with a greater abundance of fungi and a fungal cellulose-degrading gene, cbhI.","Sarah C. Fell, Jonathan L. Carrivick, Lee E. Brown",No publication date,Article,"Climate change is altering the structure and functioning of river ecosystems worldwide. In mountain rivers, glacier retreat has been shown to result in systematic changes in aquatic invertebrate biodiversity, but the effects of ice loss on other biological taxa and on whole-ecosystem functions are less well understood. Using data from mountain rivers spanning six countries on four continents, we show that decreasing glacier cover leads to consistent fungal-driven increases in the decomposition rate of cellulose, the world’s most abundant organic polymer. Cellulose decomposition rates were associated with greater abundance of aquatic fungi and the fungal cellulose-degrading Cellobiohydrolase I (cbhI) gene, illustrating the potential for predicting ecosystem-level functions from gene-level data. Clear associations between fungal genes, populations and communities and ecosystem functioning in mountain rivers indicate that ongoing global decreases in glacier cover can be expected to change vital ecosystem functions, including carbon cycle processes."
No projected global drylands expansion under greenhouse warming,https://www.nature.com/articles/s41558-021-01007-8,nature_articles/images_2021/No projected global drylands expansion under greenhouse warming.jpg,"Model projections of future drylands distribution using a proxy based on atmospheric aridity show expansion under climate change, but may not be an accurate representation. An alternative index based on ecohydrological variables such as water limitation shows no global expansion of drylands.","Alexis Berg, Kaighin A. McColl",No publication date,Article,"Drylands, comprising land regions characterized by water-limited, sparse vegetation, have commonly been projected to expand globally under climate warming. Such projections, however, rely on an atmospheric proxy for drylands, the aridity index, which has recently been shown to yield qualitatively incorrect projections of various components of the terrestrial water cycle. Here, we use an alternative index of drylands, based directly on relevant ecohydrological variables, and compare projections of both indices in Coupled Model Intercomparison Project Phase 5 climate models as well as Dynamic Global Vegetation Models. The aridity index overestimates simulated ecohydrological index changes. This divergence reflects different index sensitivities to hydroclimate change and opposite responses to the physiological effect on vegetation of increasing atmospheric CO2. Atmospheric aridity is thus not an accurate proxy of the future extent of drylands. Despite greater uncertainties than in atmospheric projections, climate model ecohydrological projections indicate no global drylands expansion under greenhouse warming, contrary to previous claims based on atmospheric aridity."
"A global analysis of subsidence, relative sea-level change and coastal flood exposure",https://www.nature.com/articles/s41558-021-00993-z,nature_articles/images_2021/A global analysis of subsidence_ relative sea-level change and coastal flood exposure.jpg,"Land subsidence and uplift influence the rate of sea-level rise. Most coastal populations live in subsiding areas and experience average rates of relative sea-level rise three to four times faster than due to climate change alone, indicating the need for policy to address subsidence.","Robert J. Nicholls, Daniel Lincke, Jiayi Fang",No publication date,Article,"Climate-induced sea-level rise and vertical land movements, including natural and human-induced subsidence in sedimentary coastal lowlands, combine to change relative sea levels around the world’s coasts. Although this affects local rates of sea-level rise, assessments of the coastal impacts of subsidence are lacking on a global scale. Here, we quantify global-mean relative sea-level rise to be 2.6 mm yr−1over the past two decades. However, as coastal inhabitants are preferentially located in subsiding locations, they experience an average relative sea-level rise up to four times faster at 7.8 to 9.9 mm yr−1. These results indicate that the impacts and adaptation needs are much higher than reported global sea-level rise measurements suggest. In particular, human-induced subsidence in and surrounding coastal cities can be rapidly reduced with appropriate policy for groundwater utilization and drainage. Such policy would offer substantial and rapid benefits to reduce growth of coastal flood exposure due to relative sea-level rise."
Fossil CO2 emissions in the post-COVID-19 era,https://www.nature.com/articles/s41558-021-01001-0,nature_articles/images_2021/Fossil CO2 emissions in the post-COVID-19 era.jpg,"Growth in CO2 emissions has slowed since the Paris Agreement 5 years ago. The COVID-19 pandemic has caused a drop in emissions of about 7% in 2020 relative to 2019, but strong policy is needed to address underlying drivers and to sustain a decline in global emissions beyond the current crisis.","Corinne Le Quéré, Glen P. Peters, Matthew W. Jones",No publication date,Brief Communication,"Five years after the adoption of the Paris Climate Agreement, growth in global CO2emissions has begun to falter. The pervasive disruptions from the COVID-19 pandemic have radically altered the trajectory of global CO2emissions. Contradictory effects of the post-COVID-19 investments in fossil fuel-based infrastructure and the recent strengthening of climate targets must be addressed with new policy choices to sustain a decline in global emissions in the post-COVID-19 era."
Sources of uncertainty in long-term global scenarios of solar photovoltaic technology,https://www.nature.com/articles/s41558-021-00998-8,nature_articles/images_2021/Sources of uncertainty in long-term global scenarios of solar photovoltaic technology.jpg,"Analysis of 1,550 future energy scenarios finds that uncertainty in solar photovoltaic (PV) uptake is mainly driven by institutional differences in designing and modelling these scenarios, rather than PV cost assumptions. This suggests more organizational diversity is needed in IPCC scenario design.","Marc Jaxa-Rozen, Evelina Trutnevyte",No publication date,Analysis,"The deployment of solar photovoltaic (PV) technology has consistently outpaced expectations over the past decade. However, long-term prospects for PV remain deeply uncertain, as recent global scenarios span two orders of magnitude in installed PV capacity by 2050. Here we systematically compile an ensemble of 1,550 scenarios from peer-reviewed and influential grey literature, including IPCC and non-IPCC scenarios, and apply a statistical learning framework to link scenario characteristics with foreseen PV outcomes. We show that a large portion of the uncertainty in the global scenarios is associated with general features such as the type of organization, energy model and policy assumptions, without referring to specific techno-economic assumptions. IPCC scenarios consistently project lower PV adoption pathways and higher capital costs than non-IPCC scenarios. We thus recommend increasing the diversity of models and scenario methods included in IPCC assessments to represent the multiple perspectives present in the PV scenario literature."
A mechanism for regional variations in snowpack melt under rising temperature,https://www.nature.com/articles/s41558-021-00996-w,nature_articles/images_2021/A mechanism for regional variations in snowpack melt under rising temperature.jpg,"Warming causes mountain snowpack to melt earlier during local spring. An idealized model suggests that melt date sensitivity to warming depends largely on mean temperature and its seasonal cycle; the largest sensitivities are seen in coastal regions, the Arctic, western United States, Central Europe and South America.","Amato Evan, Ian Eisenman",No publication date,Article,"As the planet warms, mountain snowpack is expected to melt progressively earlier each spring. However, analysis of measurements in the western United States shows that the change in the date when snowpack disappears is not uniform: for 1 °C of warming, snowpack disappears 30 days earlier in some regions, whereas there is almost no change in others. Here we present an idealized physical model that simulates the timing of snowpack melt under changing temperature and use it to show that this observed disparity in the sensitivity of snowpack disappearance to warming results from a mechanism related to the sinusoidal shape of the annual cycle of temperature. Applying this model globally, we show that under uniform warming the timing of snowpack disappearance will change most rapidly in coastal regions, the Arctic, the western United States, Central Europe and South America, with much smaller changes in the northern interiors of North America and Eurasia."
